{
  "kind": "mains",
  "subjectCode": "ECON",
  "topic": "Economic Reforms, Foreign Trade & WTO",
  "items": [
    {
      "id": "econ-reforms-trade-wto-mains-lpg-appraisal",
      "subjectCode": "ECON",
      "subtopicId": "econ-reforms-trade-wto",
      "paper": "mains-4",
      "question": "Examine the circumstances that led to the 1991 economic reforms in India and critically appraise the outcomes of the Liberalisation-Privatisation-Globalisation (LPG) strategy.",
      "modelAnswer": "By 1991 India was in a full-blown **balance of payments crisis**: forex reserves had shrunk to about **US$1.2 billion — barely two to three weeks of import cover** — amid large fiscal and trade deficits and a rising external-debt burden, with the **Gulf War** spiking oil prices and cutting Gulf remittances. To avoid default, India **pledged gold** and secured an **IMF bailout**, and PM **P.V. Narasimha Rao** with FM **Dr. Manmohan Singh** launched the **LPG reforms** — combining short-term **stabilisation** with long-term **structural** change.\n\n**Liberalisation** abolished industrial licensing for most sectors, amended the MRTP Act (later the Competition Act, 2002) and de-reserved public-sector areas. **Privatisation** brought disinvestment (Department of Disinvestment, 1999; BALCO, VSNL). **Globalisation** cut tariffs, removed quantitative restrictions, opened FDI and created SEZs.\n\n**Positive outcomes**: sustained higher GDP growth, a services/IT boom that made India a global outsourcing hub, surging FDI and forex reserves, greater competition and consumer choice, and integration with global value chains.\n\n**Critical concerns**: agriculture saw reduced public investment and farmer vulnerability to volatility; growth was **jobless and uneven**, widening regional and rural-urban disparities; some SMEs struggled against foreign competition; and over-reliance on a few sectors like IT created risk. For **Andhra Pradesh**, liberalisation boosted IT/pharma and port-led industry (Visakhapatnam) but exposed its farm-dependent economy to market swings.\n\n**Conclusion**: The reforms were a decisive and largely successful break from a stagnant controlled economy, but their gains were unequally distributed — making **inclusive, employment-generating 'second-generation' reforms** (land, labour, agriculture) the unfinished agenda.",
      "keyPoints": [
        "1991 BoP crisis: forex ~US$1.2 bn (2–3 weeks imports), twin deficits, Gulf-War oil shock; gold pledge + IMF bailout.",
        "LPG launched by Narasimha Rao/Manmohan Singh; stabilisation (short-term) + structural (long-term) mix.",
        "Liberalisation (delicensing, MRTP→Competition Act), Privatisation (disinvestment, BALCO/VSNL), Globalisation (tariff cuts, FDI, SEZs).",
        "Gains: higher growth, IT/services boom, rising FDI and forex, competition and consumer choice.",
        "Costs: agrarian distress, jobless and uneven growth, regional disparities, SME stress.",
        "Way forward: inclusive, employment-focused second-generation reforms; AP angle — IT/pharma/ports vs farm vulnerability."
      ],
      "marks": 15,
      "source": "local APPSC GK PDF — Economic Reforms in India; Balance of Payments",
      "verified": true,
      "tags": ["lpg", "1991-reforms", "mains-4"]
    },
    {
      "id": "econ-reforms-trade-wto-mains-wto-agriculture",
      "subjectCode": "ECON",
      "subtopicId": "econ-reforms-trade-wto",
      "paper": "mains-4",
      "question": "Discuss India's engagement with the WTO, with special reference to the tension between the Agreement on Agriculture and India's food-security obligations.",
      "modelAnswer": "As a **founding member** of the **WTO (established 1995, succeeding GATT)**, India accepts the multilateral trading system built on **Most-Favoured-Nation** and **National Treatment** principles and agreements such as **AoA, TRIPS, TRIMS, GATS and SPS**. India has benefited from rule-based trade and services (GATS) openings, but has consistently defended the **policy space of developing countries**.\n\nThe sharpest friction is over the **Agreement on Agriculture (AoA)**. The AoA caps trade-distorting domestic support (the 'Amber Box') at a **de minimis of 10% of the value of production** for developing countries, measured against **1986–88 reference prices**. India's **public stockholding** — procurement at **Minimum Support Price (MSP)** to run the PDS/NFSA and ensure food security — risks being counted as breaching this limit, exposing it to disputes.\n\nIndia's response has been to seek a **permanent solution** for public stockholding. At the **Bali Ministerial (2013)** it won an interim **Peace Clause** shielding such programmes from challenge until a permanent fix is agreed. India also resists deeper agri-subsidy cuts and pushed back on issues at later ministerials, and remains outside **RCEP (2019)** partly over agriculture and its China trade deficit.\n\n**Conclusion**: India's stance balances **treaty commitments with the livelihood security of millions of small farmers** and the food security of the poor. A durable outcome requires updating the AoA's outdated reference prices and honouring the mandate for a permanent public-stockholding solution — protecting food security without undermining open trade.",
      "keyPoints": [
        "India is a WTO founding member; system rests on MFN and National Treatment; key pacts AoA, TRIPS, TRIMS, GATS, SPS.",
        "AoA caps developing-country Amber Box support at de minimis 10%, against 1986–88 reference prices.",
        "India's MSP-based public stockholding for PDS/NFSA risks breaching AoA subsidy limits.",
        "Bali Ministerial 2013 Peace Clause gives interim protection pending a permanent solution.",
        "India resists deeper agri-subsidy cuts and stayed out of RCEP (2019) partly over agriculture/China deficit.",
        "Way forward: update outdated reference prices; secure a permanent public-stockholding solution."
      ],
      "marks": 15,
      "source": "WTO — AoA and Bali Ministerial 2013; local APPSC GK PDF context",
      "verified": true,
      "tags": ["wto", "aoa", "food-security", "mains-4"]
    }
  ]
}
