{
  "kind": "mains",
  "subjectCode": "HIST",
  "topic": "Mahajanapadas",
  "items": [
    {
      "id": "hist-ancient-mahajanapadas-mains-rise-factors",
      "subjectCode": "HIST",
      "subtopicId": "hist-ancient-mahajanapadas",
      "syllabusRef": "hist-scr-a1",
      "paper": "mains-2",
      "question": "Examine the socio-economic factors that transformed the smaller Janapadas of the Later Vedic age into the sixteen Mahajanapadas by the 6th century BCE.",
      "modelAnswer": "The shift from **Janapadas to Mahajanapadas** was driven by a cluster of reinforcing changes. In the **Later Vedic Period (1000–600 BCE)** pastoral clans took to **settled agriculture**, converting shifting tribal territories into fixed **state territories ('Rashtra')**. Four forces then enlarged them: **land** replaced **cattle** as the chief source of wealth; the spread of **iron weapons** elevated the **warrior class** in politics; **new agricultural tools** (especially the **iron ploughshare**) and the **transplantation of paddy** generated a **surplus** that the state could **tax** (the **Bhaga**, one-sixth of produce) to fund armies and administration; and this surplus, with expanding **trade**, produced **towns and urban centres** — the **'second urbanisation'**, marked by **Northern Black Polished Ware (NBPW)** and **punch-marked coins**. The result was sixteen territorial states, some **monarchies** and some **republics (Ganas/Sanghas)**, whose competition set the stage for Magadha's imperial rise.",
      "keyPoints": [
        "Later Vedic shift from pastoralism to settled agriculture created fixed territorial states ('Rashtra').",
        "Land replaced cattle as chief wealth; iron weapons raised the warrior class politically.",
        "Iron ploughshare + paddy transplantation → surplus, taxed as Bhaga (1/6th) to fund army & administration.",
        "Surplus + trade → second urbanisation: NBPW pottery and punch-marked coins.",
        "Outcome: 16 Mahajanapadas, both monarchies and republics, competing towards Magadhan empire."
      ],
      "marks": 15,
      "source": "local APPSC GK PDF — Ancient History: Mahajanapadas (Development of Janapadas; Rise of Mahajanapadas; Economic Growth and Urbanization)",
      "verified": true,
      "tags": ["mahajanapadas", "rise", "economy", "mains-2"]
    },
    {
      "id": "hist-ancient-mahajanapadas-mains-monarchy-vs-republic",
      "subjectCode": "HIST",
      "subtopicId": "hist-ancient-mahajanapadas",
      "syllabusRef": "hist-scr-a1",
      "paper": "mains-2",
      "question": "Distinguish between the monarchical and republican (Gana-Sangha) forms of governance among the Mahajanapadas, with examples.",
      "modelAnswer": "The Mahajanapadas fell into two governance types. **Monarchies** were ruled by a **king or queen** whose power was generally **hereditary**; authority was **centralised** in the ruler and his **court**, with a **well-defined class structure** and **rigid hierarchies**. Examples include **Magadha, Kosala, Vatsa, Avanti, Gandhara, Kamboja, Kashi, Chedi, Kuru, Panchala, Matsya, Anga and Surasena**. **Republics**, called **'Ganas' or 'Sanghas'**, rested on **collective decision-making** by a **council of representatives** drawn from ruling clans — effectively **oligarchies** — in which the head was **elected** and ruled with a council (**Ganaparishad**). **Assaka, Malla and Vajji** are the cited republics, **Vajji (Vaishali)** being the most powerful under the Sangha system. Significantly, the **founders of Jainism and Buddhism** came from such republican states, and the republics offered women and dissenters somewhat more equitable space than the monarchies' rigid order.",
      "keyPoints": [
        "Monarchy: hereditary king, centralised power in king and court, rigid class hierarchy.",
        "Republic (Gana/Sangha): council of clan representatives, elected head, oligarchic decision-making.",
        "Monarchies — Magadha, Kosala, Vatsa, Avanti, Gandhara, Kamboja, Kashi, Kuru, Panchala, Anga, Surasena.",
        "Republics — Assaka, Malla, Vajji; Vajji (Vaishali) most powerful under the Sangha system.",
        "Founders of Jainism and Buddhism emerged from the republican states."
      ],
      "marks": 15,
      "source": "local APPSC GK PDF — Ancient History: Mahajanapadas (16 Mahajanapadas & Governance; Political Structure of the Mahajanapadas)",
      "verified": true,
      "tags": ["mahajanapadas", "monarchy", "republic", "gana-sangha", "mains-2"]
    },
    {
      "id": "hist-ancient-mahajanapadas-mains-magadha-ascendancy",
      "subjectCode": "HIST",
      "subtopicId": "hist-ancient-mahajanapadas",
      "syllabusRef": "hist-scr-a1",
      "paper": "mains-2",
      "question": "Account for the ascendancy of Magadha among the sixteen Mahajanapadas and its emergence as the first empire in India.",
      "modelAnswer": "Among the sixteen Mahajanapadas, **Magadha** (capital **Rajagriha**, Bihar) rose to pre-eminence on the strength of several structural advantages. Its base in the **fertile Gangetic plains** supported intensive **rice** cultivation and a large taxable surplus; its economy was enriched by trade in **minerals and textiles**; and it commanded **military power** and **strategic alliances**. Under **Bimbisara**, Magadha began **conquering** neighbouring Mahajanapadas and welding them into a **vast empire**, so that it became the **nerve centre of political activity in North India** and, ultimately, the seat of the **Mauryan Empire**. The wider enabling context — **iron tools**, agricultural **surplus**, **punch-marked coinage**, urban **trade** and **standing armies** funded by the **Bhaga** tax — allowed a single well-endowed state to absorb its rivals, making the **Magadha Empire the first empire in India**.",
      "keyPoints": [
        "Magadha (Rajagriha) held the fertile Gangetic plains — rice surplus and a large tax base.",
        "Economic strength in minerals and textiles, plus military power and strategic alliances.",
        "Bimbisara conquered rival Mahajanapadas to build a vast empire.",
        "Became the nerve centre of North Indian politics and the base of the Mauryan Empire.",
        "Enabling context: iron tools, surplus, punch-marked coins, trade and Bhaga-funded standing armies."
      ],
      "marks": 15,
      "source": "local APPSC GK PDF — Ancient History: Mahajanapadas (Magadha; Political Structure — Bimbisara, first empire; 16 Mahajanapadas table — Magadha features)",
      "verified": true,
      "tags": ["mahajanapadas", "magadha", "bimbisara", "empire", "mains-2"]
    }
  ]
}
