{
  "kind": "mains",
  "subjectCode": "GEO",
  "topic": "Internal Structure & Major Landforms",
  "items": [
    {
      "id": "geo-landforms-structure-mains-plate-tectonics",
      "subjectCode": "GEO",
      "subtopicId": "geo-landforms-structure",
      "paper": "mains-2",
      "question": "Explain how the theory of plate tectonics accounts for the distribution of major landforms, earthquakes and volcanoes. Illustrate with reference to the Indian subcontinent.",
      "modelAnswer": "**Plate tectonics** (McKenzie and Parker, 1967; Morgan, 1968) holds that the Earth's **lithosphere** is fragmented into seven major and several minor plates that float on the plastic **asthenosphere**, driven by **mantle convection currents** generated by radioactive heat. It synthesised the earlier ideas of **Wegener's continental drift** and **Hess's sea-floor spreading**, explaining not only *that* continents move but *how*.\n\nThe distribution of landforms follows the three plate **boundaries**. At **divergent** boundaries plates move apart and magma builds new crust — mid-ocean ridges and the **East African Rift Valley** (constructive edges). At **convergent** boundaries collision produces folding, subduction and trenches — **destructive edges** that raise fold mountains and spawn deep-focus earthquakes and composite volcanoes. At **transform** boundaries plates slide past one another, deforming existing crust, as along the **San Andreas Fault**. Because plate margins concentrate stress, the world's earthquakes and volcanoes cluster there: the **Circum-Pacific 'Ring of Fire'** (~68% of quakes) and the **Alpine-Himalayan belt** (~15% of energy).\n\nThe **Indian subcontinent** is a textbook case. The Indian plate, once part of Gondwanaland, drifted north across the **Tethys Sea** and **collided with the Eurasian plate 40-50 million years ago**, crumpling sediments into the **Himalayas** — still rising, as the frequent Himalayan earthquakes and the **Himalayan Boundary Fault** attest. The northward journey also triggered the **Deccan Trap** flood-basalt eruptions (~60 mya). This tectonic legacy shapes India's hazard map: much of the Himalaya, the north-east and Kutch fall in **Seismic Zone V**, with ~59% of the country prone to moderate-severe quakes.\n\nFor **Andhra Pradesh**, the stable **Deccan/peninsular block** and the ancient **Eastern Ghats** reflect a passive-margin, low-seismicity setting, contrasting sharply with the active Himalayan front — a direct expression of the plate's rigid interior versus its convergent northern edge. Thus plate tectonics offers a single, unifying framework for the planet's structural landforms and seismo-volcanic activity.",
      "keyPoints": [
        "Lithospheric plates float on the asthenosphere, driven by mantle convection; synthesises drift + sea-floor spreading.",
        "Divergent (ridges/rift), convergent (fold mountains/trenches/subduction), transform (San Andreas) boundaries.",
        "Earthquakes/volcanoes concentrate at margins — Ring of Fire (~68%) and Alpine-Himalayan belt (~15%).",
        "Indian plate collided with Eurasia 40-50 mya raising the still-rising Himalayas; formed the Deccan Traps (~60 mya).",
        "India's Zone V (Himalaya, NE, Kutch) vs the stable Deccan/Eastern Ghats block underlying Andhra Pradesh."
      ],
      "marks": 15,
      "source": "local APPSC GK PDF — Geomorphology: Plate Tectonics; Earthquake",
      "verified": true,
      "tags": ["plate-tectonics", "himalayas", "seismic-zones", "mains-2", "ap-angle"]
    },
    {
      "id": "geo-landforms-structure-mains-fluvial-landforms",
      "subjectCode": "GEO",
      "subtopicId": "geo-landforms-structure",
      "paper": "mains-2",
      "question": "Describe the erosional and depositional landforms produced by a river along its course. How are deltas classified?",
      "modelAnswer": "A river reshapes the land through **erosion, transport and deposition**, and the balance among these shifts along its **long profile** from source to mouth, producing a characteristic sequence of landforms.\n\nIn the **youthful (upper) stage**, high-energy vertical downcutting dominates. This carves **V-shaped valleys**, deep **gorges** and **canyons** (e.g. Himalayan gorges over 500 m deep), **waterfalls** and **rapids**, and cylindrical **potholes** ground into the rocky bed by swirling debris. In the **mature (middle) stage**, lateral erosion widens the valley toward a U-shape; erosion on the outer bank and deposition on the inner bank create looping **meanders**, and cut-off loops survive as **oxbow lakes** (Kanwar Lake, Bihar — India's largest). Continued denudation may ultimately reduce the land to a near-featureless **peneplain**.\n\nAs velocity falls in the **old-age (lower) stage**, deposition prevails, yielding **alluvial fans** at mountain foots, **natural levees** flanking the channel, **braided channels** and river islands (Majuli, Assam — the world's largest), and finally the **delta** at the mouth. A delta forms where a river deposits more sediment than can be removed, aided by the **coagulation of clay in saline water**; the channel splits into distributaries.\n\n**Deltas are classified** by the balance of river versus marine energy: **arcuate** (fan-shaped, e.g. **Ganga, Nile**), **bird's-foot** (river-dominated, e.g. Mississippi), **cuspate** (wave-shaped, e.g. Tiber), **estuarine** (in submerged mouths, e.g. **Narmada and Tapi**), lacustrine, truncated and abandoned deltas.\n\nIn **Andhra Pradesh**, the mighty **Godavari and Krishna** rivers build extensive, fertile **arcuate deltas** on the east coast — the granary and aquaculture heartland of the state — a vivid example of fluvial deposition sustaining regional agriculture.",
      "keyPoints": [
        "Youth: V-valley, gorge, canyon, waterfalls, potholes (vertical downcutting).",
        "Maturity: meanders and oxbow lakes (Kanwar Lake largest in India); peneplain as end-product.",
        "Old age deposition: alluvial fans, natural levees, braided channels/river islands (Majuli), delta.",
        "Delta types: arcuate (Ganga/Nile), bird's-foot (Mississippi), cuspate (Tiber), estuarine (Narmada/Tapi).",
        "AP: Godavari and Krishna arcuate deltas underpin agriculture and aquaculture on the east coast."
      ],
      "marks": 10,
      "source": "local APPSC GK PDF — Geomorphology: Landforms(River)",
      "verified": true,
      "tags": ["fluvial", "delta", "godavari", "krishna", "mains-2", "ap-angle"]
    },
    {
      "id": "geo-landforms-structure-mains-endogenic-exogenic",
      "subjectCode": "GEO",
      "subtopicId": "geo-landforms-structure",
      "paper": "mains-2",
      "question": "\"The Earth's surface is the outcome of a continuous struggle between endogenic and exogenic forces.\" Discuss.",
      "modelAnswer": "The uneven relief of the Earth results from the ceaseless interplay of two opposing sets of **geomorphic forces** — **endogenic** (internal) forces that build up the surface and **exogenic** (external) forces that wear it down. As W. M. Davis, the founder of geomorphology, implied, every landform is a stage in this contest.\n\n**Endogenic forces** are powered by the Earth's **internal heat** (chiefly radioactive decay) and the resulting **mantle convection currents**. They express themselves as **diastrophism** — slow deformation comprising **epeirogeny** (broad continental uplift or warping) and **orogeny** (mountain building by folding and faulting) — and as **sudden movements**, namely **earthquakes and volcanic eruptions**. These raise mountains (fold, block, volcanic), plateaus and rift valleys, adding relief to the crust.\n\n**Exogenic forces** are driven by **solar energy** and gravity. Through **weathering** (physical, chemical and biological breakdown in situ) and **erosion** (removal and transport by rivers, glaciers, wind and waves) — together termed **denudation** — they dismantle the highlands and redistribute the debris. Each agent sculpts its own suite of landforms: fluvial (V-valleys, meanders, deltas), glacial (cirques, U-valleys, fjords), aeolian (dunes, yardangs, loess), karst (sinkholes, caves) and marine (cliffs, stacks, spits).\n\nThe two act as **antagonists in dynamic balance**: endogenic uplift steepens gradients and rejuvenates rivers, accelerating exogenic erosion, while erosional unloading and **isostatic adjustment** can trigger further uplift. Were endogenic forces to cease, exogenic agents would eventually grade the land to a featureless **peneplain**; because uplift continues, relief persists. The **Himalayas** — rising tectonically yet fiercely eroded by rivers and glaciers — embody this struggle, as do the ancient, worn-down **Eastern Ghats** of peninsular India where endogenic activity long ago gave way to prolonged denudation. Thus the Earth's surface is best understood not as a finished product but as an ever-evolving equilibrium between construction and destruction.",
      "keyPoints": [
        "Endogenic forces (internal heat/convection) build up relief via diastrophism (epeirogeny, orogeny) and sudden movements (quakes, volcanoes).",
        "Exogenic forces (solar energy) wear down relief via weathering + erosion = denudation.",
        "Each exogenic agent (river, glacier, wind, karst, sea) creates a distinct suite of landforms.",
        "The two are in dynamic balance; uplift rejuvenates erosion, unloading triggers isostatic uplift; peneplain is the erosional end-state.",
        "Himalayas (rising + eroding) vs worn-down Eastern Ghats illustrate the ongoing struggle."
      ],
      "marks": 15,
      "source": "local APPSC GK PDF — Geomorphology: Introduction",
      "verified": true,
      "tags": ["endogenic", "exogenic", "diastrophism", "denudation", "mains-2", "ap-angle"]
    }
  ]
}
