{
  "kind": "mains",
  "subjectCode": "GEO",
  "topic": "Social Geography (Population, Tribes, Settlements)",
  "items": [
    {
      "id": "geo-social-geography-mains-demographic-dividend",
      "subjectCode": "GEO",
      "subtopicId": "geo-social-geography",
      "paper": "mains-2",
      "question": "India is passing through a phase of 'demographic dividend'. Examine its basis in the country's changing age structure and the conditions needed to reap it, with reference to Andhra Pradesh.",
      "modelAnswer": "The **demographic dividend** is the economic-growth potential that arises when a country's **working-age population (15-64 years) is large relative to its dependants**. India's age structure has shifted decisively toward this window.\n\n**Changing age structure (Census/NCP projections)**\n- The **0-14 share fell from 42% (1971) to 29% (2011)**, projected to 23% by 2026.\n- The **15-59 working-age group rose to about 63% (2011)** and is projected to peak near 64% by 2026.\n- The elderly (60+) remain modest (~8%), keeping the **dependency ratio low** — the essence of the dividend.\n\n**Conditions needed to reap it**\n- **Human capital:** education, skilling and health so the young workforce is employable.\n- **Job creation:** manufacturing, services and MSME growth to absorb new entrants.\n- **Female participation:** raising women's low workforce participation (25.5% in 2011).\n- **Gender balance:** correcting the declining child sex ratio (919) that erodes the future base.\n\n**Andhra Pradesh angle**\nAP already has a **near-replacement fertility (TFR ~1.7)** and an ageing profile similar to south Indian states, so its dividend window is **narrower and closing sooner** than the northern states. AP must therefore front-load **skilling (e.g., industrial corridors, IT and aquaculture value chains)**, healthcare and female employment to convert its bulge before it ages.\n\n**Conclusion:** The dividend is an **opportunity, not an automatic gain** — without investment in education, health and jobs it can become a 'demographic liability', a risk sharper for early-transition states like AP.",
      "keyPoints": [
        "Demographic dividend = large working-age (15-64) share relative to dependants.",
        "0-14 fell 42% (1971) to 29% (2011); 15-59 rose to ~63% (2011) — low dependency ratio.",
        "Reaping it needs education/skilling, jobs, female participation and a corrected sex ratio.",
        "AP's near-replacement TFR (~1.7) means its dividend window is narrower and closes sooner.",
        "Without investment the dividend can turn into a demographic liability."
      ],
      "marks": 10,
      "source": "local APPSC GK PDF — World Geography: Demography; National Commission on Population projections",
      "verified": true,
      "tags": ["demographic-dividend", "age-structure", "andhra-pradesh", "mains-2"]
    },
    {
      "id": "geo-social-geography-mains-migration-urbanisation",
      "subjectCode": "GEO",
      "subtopicId": "geo-social-geography",
      "paper": "mains-2",
      "question": "Analyse the causes and consequences of rural-to-urban migration in India, and suggest measures to make urbanisation more balanced, drawing on the Andhra Pradesh experience.",
      "modelAnswer": "**Rural-to-urban migration** is a defining feature of India's urbanisation, which rose to **31.2% urban in 2011**.\n\n**Causes**\n- **Push factors:** rural unemployment, low farm incomes, fragmentation of holdings, droughts/floods and agrarian distress.\n- **Pull factors:** urban jobs, higher wages, education, healthcare and better services.\n- Streams: rural-to-rural remains the largest overall (marriage migration of women), but **rural-to-urban** drives city growth; males migrate mainly for work.\n\n**Consequences**\n- **Positive:** labour supply for industry/services, remittances to villages, skill diffusion.\n- **Negative:** overcrowding, slums, strain on housing/sanitation/transport, informalisation of labour, and rural areas left with the very young and old.\n\n**Balancing measures**\n- Strengthen **rural livelihoods** (MGNREGA, agro-processing) to reduce distress push.\n- Develop **small and medium towns** and **Census towns** as growth nodes (counter-magnets).\n- Plan cities under **AMRUT/Smart Cities** with affordable housing and services.\n\n**Andhra Pradesh angle**\nAP's coast is highly urbanised around **Visakhapatnam** and delta towns, while **Rayalaseema** sees out-migration due to drought. AP's response — the **Visakhapatnam-Chennai Industrial Corridor (VCIC)**, port-led industry and Handri-Neeva irrigation to stabilise Rayalaseema — illustrates a **dispersed, corridor-based urbanisation** strategy.\n\n**Conclusion:** Migration is inevitable and beneficial, but must be steered through **rural rejuvenation plus planned, polycentric urban growth** so that neither cities nor the countryside are destabilised.",
      "keyPoints": [
        "Urbanisation reached 31.2% (2011); rural-urban migration drives city growth.",
        "Push = rural unemployment/agrarian distress/disasters; Pull = jobs, wages, services.",
        "Consequences: labour supply and remittances vs slums, infrastructure strain, informal labour.",
        "Balancing: rural livelihoods (MGNREGA), small-town growth nodes, AMRUT/Smart Cities.",
        "AP: coastal urbanisation (Visakhapatnam), Rayalaseema out-migration; VCIC and Handri-Neeva as responses."
      ],
      "marks": 10,
      "source": "local APPSC GK PDF — World Geography: Demography; Census 2011 (urbanisation)",
      "verified": true,
      "tags": ["migration", "urbanisation", "andhra-pradesh", "mains-2"]
    },
    {
      "id": "geo-social-geography-mains-tribes-pvtg",
      "subjectCode": "GEO",
      "subtopicId": "geo-social-geography",
      "paper": "mains-2",
      "question": "Who are Particularly Vulnerable Tribal Groups (PVTGs)? Discuss their distribution and the challenges to their welfare, with special reference to Andhra Pradesh.",
      "modelAnswer": "**Particularly Vulnerable Tribal Groups (PVTGs)** are a sub-category of Scheduled Tribes identified as the **most disadvantaged** on four criteria: **pre-agricultural technology, very low literacy, stagnant or declining population, and geographical isolation**. India has **75 PVTGs across 18 states and one UT**.\n\n**Distribution**\n- They are concentrated in forested, hilly and isolated tracts — Odisha (the most), Andhra Pradesh, Jharkhand, Madhya Pradesh, the Andaman Islands (e.g., Jarawa, Sentinelese) and the North-East.\n\n**Andhra Pradesh**\n- Undivided AP had **12 PVTGs**, including the **Chenchu** (best-known, in the **Nallamala forests / Nagarjunasagar-Srisailam Tiger Reserve**), **Konda Reddi, Konda Savara, Bodo and Gutob Gadaba, Dongria and Kutia Khond, Bondo and Khond Porja**.\n- Tribes cluster in the **Eastern Ghats** (Alluri Sitharama Raju, Parvathipuram Manyam) and Nallamala; **Yanadi** (Nellore) is AP's largest Scheduled Tribe.\n\n**Challenges**\n- Loss of forest access and **displacement** by projects, dams and mining; **health vulnerability** (malnutrition, sickle-cell); very low literacy; shrinking populations; and dependence on shifting cultivation/forest produce.\n\n**Way forward**\n- Secure rights under the **Forest Rights Act 2006** and **PESA 1996**; habitat-specific **Conservation-cum-Development (CCD) plans**; culturally sensitive health and education; and livelihood support through **Minor Forest Produce/MSP for MFP** and ITDAs.\n\n**Conclusion:** PVTG welfare requires a **rights-based, habitat-specific approach** that protects both the group and its ecological base, rather than one-size-fits-all schemes.",
      "keyPoints": [
        "PVTG criteria: pre-agricultural technology, low literacy, stagnant/declining population, isolation.",
        "India has 75 PVTGs across 18 states and 1 UT; Odisha has the most.",
        "Undivided AP had 12 PVTGs; Chenchu (Nallamala/NSTR) is the best-known; Yanadi is AP's largest ST.",
        "Challenges: displacement, loss of forest access, poor health/literacy, declining numbers.",
        "Way forward: FRA 2006 & PESA 1996, habitat-specific CCD plans, MFP livelihoods and ITDAs."
      ],
      "marks": 10,
      "source": "Ministry of Tribal Affairs — PVTG scheme; en.wikipedia.org PVTG list (verified Sep 2026); AP Tribal Welfare Dept",
      "verified": true,
      "tags": ["pvtg", "tribes", "andhra-pradesh", "forest-rights", "mains-2"]
    }
  ]
}
